{
  "schemaVersion": "1.0.0",
  "target": "main",
  "policy": {
    "requiredGates": ["lint", "typecheck", "test"],
    "maxWorkers": 3
  },
  "items": [
    {"name": "copilot/fix-607ad040-6e21-4935-b6c7-b43d3940946a"},
    {"name": "copilot/fix-9febc139-27ed-4e16-b432-e4035b340417"},
    {"name": "copilot/fix-ed980654-6cea-461d-8c2a-69843bb7dcae"},
    {"name": "copilot/fix-b3530d6f-af96-4c2a-b05f-eb74cc519d01"},
    {"name": "copilot/fix-6f50f623-6f00-4e0d-8485-22a81a5628d6"},
    {"name": "copilot/fix-5681e7a5-996f-48e0-80dc-d1121906ae76"},
    {"name": "copilot/fix-e5c8d1fa-1689-4596-b747-e58071cfe83e"},
    {"name": "copilot/fix-8ad69569-d957-48ee-89d1-f20f8a170774"},
    {"name": "copilot/fix-034256c8-9638-4a93-94a3-a2a74484ec80"},
    {"name": "copilot/fix-0f99d274-4ffc-4db2-905a-2f1da7bd45d8"},
    {"name": "copilot/fix-33fe199e-2084-4ca2-95f4-680d685928fc"}
  ]
}
