{
	"schemaVersion": "1.0.0",
	"target": "main",
	"policy": {
		"requiredGates": ["lint", "test"],
		"optionalGates": [],
		"maxWorkers": 2,
		"retries": {},
		"overrides": {},
		"blockOn": [],
		"mergeRule": { "type": "strict-required" }
	},
	"items": [
		{
			"name": "pr-1",
			"deps": [],
			"gates": [
				{ "name": "lint", "run": "echo 'lint pass'", "env": {} },
				{ "name": "test", "run": "echo 'test pass'", "env": {} }
			]
		},
		{
			"name": "pr-2",
			"deps": ["pr-1"],
			"gates": [
				{ "name": "lint", "run": "echo 'lint pass'", "env": {} },
				{ "name": "test", "run": "echo 'test pass'", "env": {} }
			]
		},
		{
			"name": "pr-3",
			"deps": ["pr-2"],
			"gates": [
				{ "name": "lint", "run": "echo 'lint pass'", "env": {} },
				{ "name": "test", "run": "echo 'test pass'", "env": {} }
			]
		},
		{
			"name": "pr-4",
			"deps": ["pr-3"],
			"gates": [
				{ "name": "lint", "run": "echo 'lint pass'", "env": {} },
				{ "name": "test", "run": "echo 'test pass'", "env": {} }
			]
		},
		{
			"name": "pr-5",
			"deps": ["pr-4"],
			"gates": [
				{ "name": "lint", "run": "echo 'lint pass'", "env": {} },
				{ "name": "test", "run": "echo 'test pass'", "env": {} }
			]
		},
		{
			"name": "pr-6",
			"deps": ["pr-5"],
			"gates": [
				{ "name": "lint", "run": "echo 'lint pass'", "env": {} },
				{ "name": "test", "run": "echo 'test pass'", "env": {} }
			]
		},
		{
			"name": "pr-7",
			"deps": ["pr-6"],
			"gates": [
				{ "name": "lint", "run": "echo 'lint pass'", "env": {} },
				{ "name": "test", "run": "echo 'test pass'", "env": {} }
			]
		},
		{
			"name": "pr-8",
			"deps": ["pr-7"],
			"gates": [
				{ "name": "lint", "run": "echo 'lint pass'", "env": {} },
				{ "name": "test", "run": "echo 'test pass'", "env": {} }
			]
		},
		{
			"name": "pr-9",
			"deps": ["pr-8"],
			"gates": [
				{ "name": "lint", "run": "echo 'lint pass'", "env": {} },
				{ "name": "test", "run": "echo 'test pass'", "env": {} }
			]
		},
		{
			"name": "pr-10",
			"deps": ["pr-9"],
			"gates": [
				{ "name": "lint", "run": "echo 'lint pass'", "env": {} },
				{ "name": "test", "run": "echo 'test pass'", "env": {} }
			]
		}
	]
}
