{
  "schemaVersion": "1.0.0",
  "target": "main",
  "policy": {
    "requiredGates": ["lint", "type", "unit"],
    "optionalGates": [],
    "maxWorkers": 3,
    "retries": {
      "unit": {
        "maxAttempts": 1,
        "backoffSeconds": 10
      }
    }
  },
  "items": [
    {
      "name": "PR-108-autopilot-level3",
      "deps": [],
      "gates": [
        {
          "name": "lint",
          "run": "npm run lint"
        },
        {
          "name": "type",
          "run": "npm run typecheck"
        },
        {
          "name": "unit",
          "run": "npm test"
        }
      ]
    },
    {
      "name": "PR-110-dependency-parser",
      "deps": [],
      "gates": [
        {
          "name": "lint",
          "run": "npm run lint"
        },
        {
          "name": "type",
          "run": "npm run typecheck"
        },
        {
          "name": "unit",
          "run": "npm test"
        }
      ]
    },
    {
      "name": "PR-111-file-analysis",
      "deps": [],
      "gates": [
        {
          "name": "lint",
          "run": "npm run lint"
        },
        {
          "name": "type",
          "run": "npm run typecheck"
        },
        {
          "name": "unit",
          "run": "npm test"
        }
      ]
    },
    {
      "name": "PR-112-developer-onboarding",
      "deps": [],
      "gates": [
        {
          "name": "lint",
          "run": "npm run lint"
        },
        {
          "name": "type",
          "run": "npm run typecheck"
        },
        {
          "name": "unit",
          "run": "npm test"
        }
      ]
    },
    {
      "name": "PR-113-production-monitoring",
      "deps": [],
      "gates": [
        {
          "name": "lint",
          "run": "npm run lint"
        },
        {
          "name": "type",
          "run": "npm run typecheck"
        },
        {
          "name": "unit",
          "run": "npm test"
        }
      ]
    },
    {
      "name": "PR-109-safety-framework",
      "deps": ["PR-108-autopilot-level3"],
      "gates": [
        {
          "name": "lint",
          "run": "npm run lint"
        },
        {
          "name": "type",
          "run": "npm run typecheck"
        },
        {
          "name": "unit",
          "run": "npm test"
        }
      ]
    }
  ]
}